,title,url,thubmnail,channel_name,description
0,EXPLODING Glitter Bomb 4.0 vs. Package Thieves,https://www.youtube.com/watch?v=3c584TGG7jQ,https://i.ytimg.com/vi/3c584TGG7jQ/hqdefault.jpg?sqp=-oaymwEcCPYBEIoBSFXyq4qpAw4IARUAAIhCGAFwAcABBg==&rs=AOn4CLDlN1VIZYidCfa6y-8-kO1i5UQctw,Mark Rober,"Merry Christmas ya filthy animals. If you want to learn the design fundamentals it takes to make something like the Glitter Bomb, enroll in my Creative Engineering course at https://Monthly.com/Mar..."
1,Why We Should NOT Look For Aliens - The Dark Forest,https://www.youtube.com/watch?v=xAUJYP8tnRE,https://i.ytimg.com/vi/xAUJYP8tnRE/hqdefault.jpg?sqp=-oaymwEcCPYBEIoBSFXyq4qpAw4IARUAAIhCGAFwAcABBg==&rs=AOn4CLAdJIlFgRWPXCrtwjAR-0s6hFnfBw,Kurzgesagt – In a Nutshell,Getting something from the kurzgesagt shop is the best way to support us and to keep our videos free for everyone. Thank You! ►► https://kgs.link/shop. (Worldwide Shipping Available) Sources...
2,My Toddler paints her Zodiac sign!! #shorts,https://www.youtube.com/shorts/Pz9ODRKR1UE,https://i.ytimg.com/vi_webp/Pz9ODRKR1UE/hq2.webp,Melissa Metrano,
3,Sarah’s Secret Friend pam_a_cake #shorts,https://www.youtube.com/shorts/3WeqiMsgyMI,https://i.ytimg.com/vi/3WeqiMsgyMI/hq2.jpg,ms_pam_a_cake official,
4,The Unbearable Weight of Massive Talent (2022 Movie) Official Red Band Teaser Trailer – Nicolas Cage,https://www.youtube.com/watch?v=I8VuWhvk87o,https://i.ytimg.com/vi/I8VuWhvk87o/hqdefault.jpg?sqp=-oaymwEcCPYBEIoBSFXyq4qpAw4IARUAAIhCGAFwAcABBg==&rs=AOn4CLB_KBKi14kPCTGEPmrrGcl3eFauoQ,Lionsgate Movies,"The Unbearable Weight of Massive Talent – In Theaters April 22, 2022. Nicolas Cage, Pedro Pascal, Sharon Horgan, Ike Barinholtz, Alessandra Mastronardi, Jacob Scipio, Lily Sheen, with Neil..."
5,Everything Everywhere All At Once | Official Trailer HD | A24,https://www.youtube.com/watch?v=wxN1T1uxQ2g,,A24,"SUBSCRIBE: http://bit.ly/A24subscribe A film from Daniels and starring Michelle Yeoh, Ke Huy Quan, Stephanie Hsu, Jenny Slate, Harry Shum Jr., with James Hong and Jamie Lee Curtis. EVERYTHING..."
6,I dug a real tunnel using ONLY a toy Minecraft pickaxe...,https://www.youtube.com/watch?v=lUOr8Y-EgF4,,Tyler Oliveira,"3,000,000 SUBS AND MY DAD WILL FINALLY BE PROUD! FOLLOW ME ON INSTAGRAM - @tyleroliveiraofficial FOLLOW ME ON TWITTER - @tyleraloevera FOLLOW ME ON TIK TOK - @tyler.oliveira"
7,I Broke My Leg... (not a prank),https://www.youtube.com/watch?v=8-9ArOm-Oek,,Ben Azelart,I broke my leg and explained the whole story for you guys... SUBSCRIBE to my Patreon! http://www.patreon.com/benazelart GET THE MERCH! https://staywildshop.com Don't forget to SUBSCRIBE...
8,u totally caught me making soup,https://www.youtube.com/watch?v=Xl1iR47dzes,,emma chamberlain,"basil, pea, and potato soup recipe: - Boil 12 chopped fingerling potatoes for 20 minutes, and boil 4 cups of fresh english peas for 5 minutes, then set both aside - Heat olive oil in a large..."
9,Fantastic Beasts: The Secrets of Dumbledore – Official Trailer,https://www.youtube.com/watch?v=Y9dr2zw-TXQ,,Warner Bros. Pictures,"You are invited back to the magic. Fantastic Beasts: The Secrets Of Dumbledore is in theaters April 15, 2022. #SecretsOfDumbledore ----------------- https://www.facebook.com/fantasticbeastsmovie/..."
